2007.07.02	듀스	여름안에서	남	댄스	이현도	이현도	예당 음향 (예당 컴퍼니)	언제나 꿈꿔 온 순간이 여기 지금 내게 시작되고 있어 그렇게 너를 사랑했던 내마음을 넌 받아 주었어 오 내 기분만큼 밝은 태양과 시원한 바람들이 내게 다가와 나는 이렇게 행복을 느껴 하늘은 우릴 항해 열려 있어 그리고 내곁에는 니가 있어 환한 미소와 함께 서 있는 그래 너는 푸른 바다야  같은 시간 속에 이렇게 함께 있는 것 만으로도 난 좋아 행복한 미소에 니얼굴 나 더이상 무얼 바라겠니 저 파란 하늘아래서 너와 나 여기 이렇게 사랑하고 있어 나는 이렇게 행복을 느껴 하늘은 우릴 항해 열려 있어 그리고 내곁에는 니가 있어 환한 미소와 함께 서 있는 그래 너는 푸른 바다야  더이상 슬픔은 없는 거야 지금 행복한 너와나 태양 아래 우린 서로가 사랑하는걸 알아 하늘은 우릴 항해 열려 있어 그리고 내곁에는 니가 있어 환한 미소와 함께 서 있는 그래 너는 푸른 바다야 하늘은 우릴 항해 열려 있어 그리고 내곁에는 니가 있어 환한 미소와 함께 서 있는 그래 너는 푸른 바다야 너는 푸른 바다야 난 너를 사랑해 난 너를 사랑해 난 너를 사랑해 난 너를 사랑해  난 너를 사랑해 난 너를 사랑해  난 너를 사랑해 난 너를 사랑해  난 너를 사랑해 난 너를 사랑해  난 너를 사랑해 난 너를 사랑해 난 너를 사랑해 난 너를 사랑해 난 너를 사랑해 난 너를 사랑해 난 너를 사랑해 난 너를 사랑해 난 너를 사랑해
1996	듀스	약한 남자	남	랩/힙합	이현도	이현도	예당 음향 (예당 컴퍼니)	오에오 오에오에오 오에오 오에오에오 지금 나!아!아!아!의 마음속에 그리고 또 머리 속엔 꽉!꽉! 차있는 건 바로 바로 바로 바로 너를 향한 나의 벅찬 마음 뿐이야 아주 오랫동안을 그렇게 매일마다 너의 얼굴 생각해 왔어 이런 내 처지를 어떻게 해야 너한테 알릴 수가 있지? 침착해 혹!혹!혹!혹시나 그래 맞아 만일에 남자친구가 있다면 어떡하지 난 이렇게 생각을 해봐도 안되고 다르게 생각을 해봐도 안되고 난 정말 고민이 너무 많아 하!하!하!히지만 역시 나는 만일에 남자친구가 없다고해도 걱정이야 오에오 오에오에 오늘 만나서 나의 마음을 보여줘야 할까 오에오 오에오에 오직 나의 마음에는 항상 너뿐이라고 말이야 하지만 두려워 그렇게도 망설이던 나 드디어는 심지어는 이제 네게 고백 하기로 했어 준비가 됐어 나 더 이상은 고민하며 지낼 수는 없었어 잘못되어 버릴 수 있다는 걸 알! 아! 그래도 혹시 몰라 나 몰라 아! 아! 다만 가만히 이렇게 계속 내가 있으면 아무것도 아니라는 게 더 두려워 이제 난 용감해져야 돼 너를 너를 얻기 위해서라면 너를 얻기 위해서라면 난 뭐든지 할 수 있을 것 같아 불안함에 몸은 떨리지만 나는 그래도 남자라고 사람들은 말해 주지 그래 그래 나는 용감하게 정면으로 부딪치는 거야 오에오 오에오에 오기를 길가옆 골목에서 기다리고 있어 오에오 오에오에 오고 있어 저기 but 갑자기 머리가 복잡해  이렇게 복잡해 신은 정말 없는 걸까 나는 어째서 이리도 어지러운 걸까? 오 오 어쩌면은 나를 이렇게 참담하게 하는 거야? 이제는 두 번 다시 나설 수가 없어 영영 안녕이라고 말해야겠지 너무나 가슴이 아파 나는 쓰러져 버릴 것 같아 지금 오 너의 그런 표정 정말 나는 처음 봤어 다시 다시 비길 다시 두 번 다시 못 볼 그런 얼굴이었지 그리고 더욱 충격은 그런 차가운 목소리 평생 처음 들었어 이제 나는 똑똑히 알게 되었지 너의 이상형은 내가 결코, 절대 아님을 평생 기억에 남을 지금 내 눈의 눈물 오에오 오에오에 오만 하기만한 너의 그 작고 예쁜 얼굴 오에오 오에오에 오늘 일은 결코 나는 잊을 수가 없을 꺼야 오에오 오에오에오 오에오 오에오에오 오에오 오에오에오 오에오 오에오에오
1995.04.13	듀스	너에게만	남	랩/힙합	이현도	이현도	예당 음향 (예당 컴퍼니)	너는 내게서 멀어져 가고 나는 혼자 남게 됐지만 너의 기억은 아직도 나를 자꾸 눈물짓게 하지 내 맘에 내리는 이 비는 너만이 멈출 수 있어 내 눈에 흐르는 눈물은 오직 너만이 멈출 수가 있어 my baby 너는 지금 내게서 너무나 멀리에 다시 내게 올 수 없지만 눈을 감으면 아직도 나의 가슴에 항상 니가 웃으며 서 있는데 그렇게 쉽게 나를 떠났지만 나는 아직도 지울 수 없어 내가 너를 사랑했던 것만큼 그 만큼 내가 슬퍼질 뿐 내 맘에 내리는 이 비는 너만이 멈출 수 있어 내 눈에 흐르는 눈물은 오직 너만이 멈출 수가 있어 my baby 너는 지금 내게서 너무나 멀리에 다시 내게 올 수 없지만 눈을 감으면 아직도 나의 가슴에 항상 니가 웃으며 서 있는데  미워하지 않아 이렇게 가슴 아파도 널 너는 지금 내게서 너무나 멀리에 다시 내게 올 수 없지만 눈을 감으면 아직도 나의 가슴엔 널 사랑하는 마음뿐이야  멀어지는 너를 바라보는 것이 그때 내가 할 수 있는 전부 였어 하지만 나는 아직도 널 잊을 수가 없어 my angel eyes 사랑해 그대 언제까지나
1996	듀스	Go!Go!Go!	남	랩/힙합	이현도	이현도	예당 음향 (예당 컴퍼니)	RAP) 우리들의 어린 시절 이미 지나갔고 어른이란 이름으로 힘든 직장 갖고 생활하면서 이미 뽀얀 얼굴은 갔고, 그런걸 갖고 고생이라 말하고 고지식한 생각으로 남을 무시하고 동심을 가진 어른들 이상하다하고 전자 게임, 프라모델, 만활 싫어하고 그게 왜 재미있는지 이해를 못하고 그런 사람을 보며 나는 답답하고 하지만 그 사람 역시 내가 답답하고 얽히고, 설키고 꼬이고 막히고...  SONG) 어렵게 생각하면 힘든 세상이지만 행복은 그리먼게 아니야 작은 기쁨을 느낄 수 있다면 이미 넌 행복하거야.  RAP) 이 넓은 세상에서 자기만 잘났고 조그만 일 하날해도 남들보다 났고 이거든지 저거든지 남들은 못났고 자기 위친 높고 나의 위친 낮고 그런 식으로 언제나 이 세상을 살고 자기 잘못을 모르고 계속 그리 살고 남들에게 원망 듣는 줄도 모르고 계속 그렇게 끝이 없이 짜증나게 굴고 계속 그러면 그대만 혼자 고립되고 그게 싫으면 이제는 안 그러면 되고 그래, 남의 입장에서 좀더 이해하면 결국에는 모두 행복하게 되고  자! 한 마디 쉬고  RAP) 질투와 시기는 우리에게 필요 없고 가식과 허식은 우리 더욱 필요 없고 서로에게 한번씩 더 웃어줄수 있는 마음만 있다면 우리 문제될 게 없고 하지만 그런 마음 쉽지만은 않고 심지어는 그러려고 생각조차 않고 마음을 닫고 두 귀를 막고 세상에 모든 고민 혼자 얼싸안고 이제는 그런 생각 다 털어 버리고 닫혀 있는 마음 활짝 열어 버리고 그러면 다른 사람의 얘기도 들리고 그대도 더욱 세상 고민 줄이고  SONG) 반복  RAP) 세상이란 우리 속에 우리 지금 살고 서로 자기 이득 위해 아웅다웅 살고 멈추면 안돼, 놓치면 안돼 빨리빨리 움직여야 겨우 나는 살고 시간은 째깍째깍 잘도 흘러가고 세상은 매일매일 빨리 돌아가고 조금만 여유를 찾고, 쉬고 하다 보면 난 막바로 옛날 사람되고 하지만 유행은 갔다 돌아오고 더 많은 시간들이 내게 다가오고 그러니깐 이제 그만 여유도 찾고 진정으로 사랑할 때 연인도 찾고
1995.04	노이즈	상상속의 너	남	댄스	김창환	김창환	라인 기획	나는 가끔 이런 생각들을 했어 내가 사랑할 수 있는 누군가도 지금 나와같은 생각으로 나의 모습들을 가끔씩 그려보는지 이런저런 상상속에 많은 시간들은 나를 외롭게 만들었지만 나는 기다렸어 그날이 오기를 바로 오늘을 오늘 나는 우연히 널 보고 말았어 나에 상상 속에 그리던 널 나의 눈이 너와 마주치던 그 순간 나는 굳어버렸지 할말도 잃어버린 채 어떡해야 그대에게 말을 건넬까 나의 맘은 두근거렸지만 내게 슬쩍 눈길을 주며 웃는 그댈 이젠 사랑할 수밖에 없어 너무 오랫동안 나는 기다렸어 나의 친구들은 애인이 있는데 나만 혼자라는 외로움에 가끔 나는 내 자신을 미워했었지만 그래 한번 참아보는 거야 어디까지 그댈 기다려야 하는지 나의 인내심은 그대를 만났어 바로 이 순간 오늘 나는 우연히 널 보고 말았어 나에 상상 속에 그리던 널 나의 눈이 너와 마주치던 그 순간 나는 굳어버렸지 할말도 잃어버린 채 어떡해야 그대에게 말을 건넬까 나의 맘은 두근거렸지만 내게 슬쩍 눈길을 주며 웃는 그댈 이젠 사랑할 수밖에 없어 나는 가끔 이런 생각들을 했어 내가 사랑할 수 있는 누군가도 지금 나와같은 생각으로 나의 모습들을 가끔씩 그려보는지 이런저런 상상속에 많은 시간들은 나를 외롭게 만들었지만 나는 기다렸어 그날이 오기를 바로 오늘을 오늘 나는 우연히 널 보고 말았어 나에 상상 속에 그리던 널 나의 눈이 너와 마주치던 그 순간 나는 굳어버렸지 할말도 잃어버린 채 어떡해야 그대에게 말을 건넬까 나의 맘은 두근거렸지만 내게 슬쩍 눈길을 주며 웃는 그댈 이젠 사랑할 수밖에 없어 어떡해야 그대에게 말을 건넬까 나의 맘은 두근거렸지만 내게 슬쩍 눈길을 주며 웃는 그댈 이젠 사랑할 수밖에 없어
1995.04	노이즈	어제와 다른 오늘	남	댄스	김창환	김창환	라인 기획	나에게 할말이 있다면 빙빙 돌리지 말고 말해 아직은 너와나 사이에 변한건 아무것도 없으니깐 오늘로 너와의 만남이 나에게 마지막이라면 난 네게 꼭 듣고 싶은 말이 한마디 남아있는데 날 사랑했다는 말도 이젠 그렇게 쉽지는 않겠지만 이대로 이별이라면 내게 아낄 필요는 없잖아 아직은 니곁에 있는 날 더이상 초라한 바보로 만들어 버리지는마 어제까지 너와함께 했던 그 모든 시간들을 오늘은 널 위해 모두다 슬픔과 바꿔야겠지만 후회없는 사랑을 했기에 난 널 미워하지않아 다만 널 잡지못하는 내 자신이 미워질뿐이야 너에게 난 부담스런 존재로 남아있긴 싫어 그래서 난 택했던 거야 너와의 슬픈 이별을 널 포기한 채로 나에게 싫증이 났다면 이쯤에서 널 잊어줄게 그렇게 나에게 일부러 냉정한척 하려 하지마 그렇게 하지 않아도 난 널 보내줄수 있어 아직 내겐 사랑이 남아있으니까 어제까지 너와함께 했던 그 모든 시간들을 오늘은 널위해 모두다 슬픔과 바꿔야겠지만 후회없는 사랑을 했기에 난 널 미워하지않아 다만 널 잡지못하는 내 자신이 미워질뿐이야 너에게 난 부담스런 존재로 남아있긴 싫어 그래서 난 택했던 거야 너와의 슬픈 이별을 널 포기한 채로
1992.11	노이즈	너에게 원한건	남	댄스	천성일	홍종구	라인 기획	오늘도 우린 함께 했지 흠 난 또 한 번 느꼈어 너도 날 사랑하고 있다는 걸 항상 난 너만을 이해하려고 하지만 너는 언제나 너의 뜻대로만 움직였지 너에게 원한 건 (너에게 원한 건) 어려운 고백은 아냐 (아니야) 날 사랑하는 것만큼 표현해주는 것 (내가) 느낄 수 있도록 - 연 주 중 - 너는 진실한 마음을 깊이 감추고 그냥 장난스런 겉모습으로 날 대하지만 난 아무 상관 없어 그렇게 날 대하는 너 또한 어색한 걸 난 알 수 있어 너에게 원한 건 (너에게 원한 건) 어려운 부탁은 아냐 (아니야) 서로 관심을 조금씩만 가져주는 것 서로 느낄 수 있도록  오늘도 우린 함께 했지 흠 난 또 한 번 느꼈어 너도 날 사랑하고 있다는 걸 이젠 내게서 달아나려고 하지마 너의 맘을 내게 모두 다 들켜버렸으니까 너에게 원한 건 (너에게 원한 건) 어려운 고백은 아냐 (아니야) 날 사랑하는 것만큼 표현해주는 것 너에게 원한 건 (너에게 원한 건) 어려운 부탁은 아냐 (아니야) 서로 관심을 조금씩만 가져주는 것 서로 느낄 수 있도록
2009.06.25	노이즈	너에게 원한건	남	댄스	천성일	홍종구	라인 기획	I Like Noise  Bounce Bounce Bounce Bounce ye  오늘도 우린 함께했지 흥 난 또한번 느꼈어 너도 날 사랑하고 있다는걸 항상 난 너만을 이해하려고 하지만 너는 언제나 너의 뜻 대로만 움직였지 너에게 원한건 너에게 원한건 어려운 고백은 아니야 아니야 날 사랑하는 것 만큼 표현 해 주는거 내가 느낄 수 있도록 너는 진실한 마음을 깊이 감추고 그냥 장난스런 겉 모습으로 날 대하지만 난 아무 상관없어 그렇게 날 대하는 너 또한 어색한걸 난 알 수 있어 너에게 원한건 너에게 원한건 어려운 부탁은 아니야 아니야 서로 관심을 조금씩만 가져 주는것 서로 느낄 수 있도록  오늘도 우린 함께했지 흥 난 또한번 느꼈어 너도 날 사랑하고 있다는걸 이젠 내게서 달아나려고 하지마 너의 맘을 내게 모두다 들켜 버렸으니까 너에게 원한건 너에게 원한건 어려운 고백은 아니야 아니야 날 사랑하는것 만큼 표현 해 주는거 너에게 원한건 너에게 원한건 어려운 부탁은 아니야 아니야 서로 관심을 조금씩만 가져주는것 서로 느낄 수 있도록
1995.11	노이즈	착각	남	댄스	김창환	김창환	라인 기획	너의 친철함에 나는 속았었나봐 너도 날 좋아한다고 그렇게 믿었는데 너의 성격이 원래 상냥하다는 걸 알면서도 나는 왠지 그렇게 믿었었어 그러던 어느날인가 너는 나에게 너의 애인을 소개시켜 주며 인사를 나누라는데 나의 눈앞이 왜 자꾸 캄캄해져만 오는지 어색해하는 나의 표정을 바라보며 너도 그제서야 내가 널 좋아하는걸 알았나봐 하지만 그래도 어쩔 수가 없잖아 그저 나 혼자의 착각속에 너를 좋아한것 뿐이니까  너를 보면서 난 착각을 해왔었지 너의 친철함을 나는 믿었었기에 그게 사랑인줄 알고 나는 나 혼자서 많은 날을 설레이며 고민해왔었어 너의 변함없는 태도를 보면서 나는 조금은 이상하다는 생각을 했지만 그래도 난 내자신을 믿고 싶었어 니가 날 좋아한다고 그러던 어느날인가 너는 나에게 너의 애인을 소개시켜 주며 인사를 나누라는데 나의 눈앞이 왜 자꾸 캄캄해져만 오는지 어색해하는 나의 표정을 바라보며 너도 그제서야 내가 널 좋아하는걸 알았나봐 하지만 그래도 어쩔 수가없잖아 그저 나 혼자의 착각속에 너를 좋아한것 뿐이니까  너의 친철함에 나는 속았었나봐 너도 날 좋아한다고 그렇게 믿었는데 너의 성격이 원래 상냥하다는걸 알면서도 나는 왠지 그렇게 믿었었어 그런던 어느날인가 너는 나에게 너의 애인을 소개시켜 주며 인사를 나누라는데 나의 눈앞이 왜 자꾸 캄캄해져만 오는지 어색해하는 나의 표정을 바라보며 너도 그제서야 내가 널 좋아하는걸 알았나봐 하지만 그래도 어쩔수가 없잖아 그저 나 혼자의 착각속에 너를 좋아한것 뿐이니까 나의 표정을 바라보며 너도 그제서야 내가 널 좋아하는걸 알았나봐 하지만 그래도 어쩔수가 없잖아 그저 나혼자의 착각속에 너를 좋아한것 뿐이니까
1996.11	노이즈	성형미인	남	댄스	김창환	김창환	라인 기획	요즘 세상엔 왜 그리도 많은 미인이 사는 걸까 그저 여자라 잘해준 것 뿐인데 자길 좋아하는 줄 알고 고친 얼굴인 줄 알며 난 이쁘단 인사 치레를 했는데 지가 정말 예뻐 그러는 줄 알고 더 이쁜 척을 하려 하지 어이없게  요즘 들어선 신종 전염병이 유행을 하지 모두가 빚을 내서라도 성형을 하려 하고 자기가 본래 본 바탕이 예뻤던 것처럼 그렇게 성형미인들은 거리를 활보하지만 어릴적 사진들은 모두 없애고 겉으론 당당하게 결혼하지만 2세가 태어나면 모두 놀라고 그럴땐 남자집안 탓을 하면서 꼭 그렇게까지라도 해서 모두가 미인이 되고플까 똑같은 얼굴 똑같은 성형미인만을 꿈꾸며 요즘 세상엔 왜 그리도 많은 미인이 사는 걸까 그저 여자라 잘해준 것 뿐인데 자길 좋아하는 줄 알고 고친 얼굴인 줄 알며 난 이쁘단 인사 치레를 했는데 지가 정말 예뻐 그러는 줄 알고 더 이쁜 척을 하려 하지 어이없게  세상은 정말 너무도 많이 변해버렸지 하늘이 주신 관상까지 돈으로 고쳐가고 새로운 얼굴의 새로운 세상을 만났다는 듯이 그렇게 성형미인들은 신에게 도전하지만 TV를 켜면 성형미인들 세상 더욱더 예뻐지려는 여자의 욕망 그들과 똑같아지려는 사람들 그런 미인을 즐기려는 남자들 꼭 그렇게까지라도 해서 모두가 미인이 되고플까 똑같은 얼굴 똑같은 성형미인을 꿈꾸며 요즘 세상엔 왜 그리도 많은 미인이 사는 걸까 그저 여자라 잘해준 것 뿐인데 자길 좋아하는 줄 알고 고친 얼굴인 줄 알며 난 이쁘단 인사 치레를 했는데 지가 정말 예뻐 그러는 줄 알고 더 이쁜 척을 하려 하지 어이없게
1995.04	노이즈	체념	남	댄스	천성일	홍종구	라인 기획	이젠 너에게 아무것도 난 바라지 않아 단지 널 잊어 달란 말 제발 내게 하지 말아줘 오오오 내가 너만을 그렇게 사랑한지 몰랐어 내가 이렇게 슬퍼할 줄은 그때는 정말 몰랐어 나를 기억하지 않아도 돼 나는 괜찮아 지금 나보다 더 너를 사랑해 줄 그 누군가가 있다면 내가 너의 이별 앞에서 웃을 수 있는건 아직 내가 너를 세상 누구보다 정말 사랑하기 때문이야 너를 기억하고 널 그리워하는 내 모습이 네게 부담이 되면 너의 행복한 사랑을 위해서 널 조금만 그리워할께 하지만 영원히 널 잊어달라고 내게 말하지마 사랑했다면 이젠 널 기억할 수 있을때까지 난 살아있고 싶어 나를 기억하지 않아도 돼 나는 괜찮아 지금 나보다 더 너를 사랑해 줄 그 누군가가 있다면 내가 너의 이별 앞에서 웃을 수 있는건 아직 내가 너를 세상 누구보다 정말 사랑하기 때문이야 너를 기억하고 널 그리워하는 내 모습이 네게 부담이 되면 너의 행복한 사랑을 위해서 널 조금만 그리워할께 하지만 영원히 널 잊어달라고 내게 말하지마 사랑했다면 이젠 널 기억할 수 있을때까지 난 살아있고 싶어
1994.03	노이즈	내가 널 닮아갈 때	남	댄스	천성일	천성일	라인 기획	늦었지만 솔직히 말할게 처음 서로를 알게 된 그 때 이제와서 이런 말할 필욘없지만 나는 너를 별로라고 생각했어 너의 그런 촌스런 모습 너의 그런 무딘 센스 하지만 지금도 이해할 수 없던 것은 너를 멀리할 수 없었다는 걸 내가 널 닮아갈 때 으흠 니가 날 닮아갈 때 우리 서로 닮아가는 그 동안의 얘기가 너무 재밌지 않니 나의 그런 냉정한 성격 나의 그런 조급한 마음 모든 것이 널 만난 후부터 그렇게 조금씩 너처럼 무뎌지고 있었다는 걸 난 자신할 수 있었지 그렇지만 쉽지는 않았지 그런 너도 날 닮아가려고 꽤 많이 노력하는 것을 알게됐어 내가 널 닮아갈 때 으흠 니가 날 닮아갈 때 우리 서로 닮아가는 그 동안의 얘기가 너무 재밌지 않니 그렇게 다 얘기하지 내 모습이 너무나 변했다고 그래 사랑을 해봐 모든 것을 바꿔봐 그런 것들이 날 얼마나 기쁘게 하는지 생각해 봐 생각해 봐 그 모든 걸 그 모든 걸 샤바라바라바랍  시간은 그렇게 흘러갔어 나는 자꾸 널 닮아갔지 그렇게 세련된 것만 좋아하던 내가 이젠 털털한 성격의 소유자가 됐어 그러던 어느날 널 봤지 나는 미처 알아보지 못했어 그 곳엔 어느덧 매우 세련된 나의 공주님이 웃고 서있다는 걸 내가 널 닮아갈 때 으흠 니가 날 닮아갈 때 우리 서로 닮아가는 그 동안의 얘기가 너무 재밌지 않니 그렇게 다 얘기하지 내 모습이 너무나 변했다고 그래 사랑을 해봐 모든 것을 바꿔봐 그런 것들이 날 얼마나 기쁘게 하는지 생각해 봐 생각해 봐 그 모든 걸 그 모든 걸 생각해 봐 생각해 봐
1995.11	노이즈	홀로서기	남	댄스	김창환	김창환	라인 기획	모든게 그렇듯 다 생각하기 나름이지 니가 날 싫다는데 내가 널 왜못잊어 착각하지마 지금까지는 내가 널 사랑했기 때문에 참아왔던 것 뿐야 이제는 너보다 더 냉정해질 수 있어 어설픈 슬픔따윈 내게 기대하지마 모든걸 돌려줄께 너에게 받았던 그흔한 감정까지 그렇게 서투른 연극 따위는 하지마 내가 싫다면서 슬픈척하는 니가 난 정말 미웠어 나에게 더 좋은 사람을 만나라는 말도 너의 가식적인 표현으로 밖에 나는 들리지 않아 이제는 모든걸 잊어줄께 니가 바라는 대로 또 원하는 대로 나도 너만큼 쉽게 널 잊기위해서 냉정한 모습을 보이려 애쓸꺼야 어차피 이별을 앞에 두고 우린 서로의 맘을 숨길 필욘 없잖아 버릴건 버리고 잊을건 잊는게 서로를 위하는거야  난 정말 몰랐어 니가 날 싫어한다는 그런사실이 너무 견디기힘들어 아무 소용없다는 걸알면서도 난 마지막으로 네게 화를 냈던거야 어쩌면 나보다 니가 더 괴로울 것 같다는 생각을 나는 잠시 해 봤지만 그건 스쳐가는 생각이었을 뿐 난 화가 났었던거야 그렇게 서투른 연극따위는 하지마 내가 싫다면서 슬픈척하는 니가 난 정말 미웠어 나에게 더 좋은 사람을 만나라는 말도 너의 가식적인 표현으로 밖에 나는 들리지 않아 이제는 모든걸 잊어줄께 니가 바라는 대로 또 원하는 대로 나도 너만큼 쉽게 널 잊기위해서 냉정한 모습을 보이려 애쓸꺼야 어차피 이별을 앞에 두고 우린 서로의 맘을 숨길 필욘 없잖아 버릴건 버리고 잊을건 잊는게 서로를위하는거야
1996.11	노이즈	착각 (Remix)	남	댄스	김창환	김창환	라인 기획	너의 친절함에 나는 속았었나봐 너도 날 좋아한다고 그렇게 믿었는데 너의 성격이 원래 상냥하다는 걸 알면서도 나는 왠지 그렇게 믿었었어 그러던 어느 날인가 너는 나에게 너의 애인을 소개시켜주며 인사를 나누라는데 나의 눈앞이 왜 자꾸 캄캄해져만 오는지 어색해하는 나의 표정을 바라보며 너두 그제서야 내가 널 좋아하는 걸 알았나봐 하지만 그래도 어쩔 수가 없잖아 그저 나혼자의 착각속에 너를 좋아한것 뿐이니까 너를 보면서 난 착각을 해왔었지 너의 친절함을 나는 믿었었기에 그게 사랑인줄 알고 나는 혼자서 고민해왔었j어 너의 변함없는 태도를 보면서 나는 조금은 이상하다는 생각을 했지만 그래도 난 내 자신을 믿고 싶었어 니가 날 좋아한다고 그러던 어느 날인가 너는 나에게 너의 애인을 소개시켜주며 인사를 나누라는데 나의 눈앞이 왜 자꾸 캄캄해져만 오는지 어색해하는 나의 표정을 바라보며 너두 그제서야 내가 널 좋아하는 걸 알았나봐 하지만 그래도 어쩔 수가 없잖아 그저 나혼자의 착각속에 너를 좋아한것 뿐이니까 - 간 주 중 - 너의 친절함에 나는 속았었나봐 너도 날 좋아한다고 그렇게 믿었는데 너의 성격이 원래 상냥하다는 걸 알면서도 나는 왠지 그렇게 믿었었어 그러던 어느 날인가 너는 나에게 너의 애인을 소개시켜주며 인사를 나누라는데 나의 눈앞이 왜 자꾸 캄캄해져만 오는지 어색해하는 나의 표정을 바라보며 너두 그제서야 내가 널 좋아하는 걸 알았나봐 하지만 그래도 어쩔 수가 없잖아 그저 나혼자의 착각속에 너를 좋아한것 뿐이니까 어색해하는 나의 표정을 바라보며 너두 그제서야 내가 널 좋아하는 걸 알았나봐 하지만 그래도 어쩔 수가 없잖아 그저 나혼자의 착각속에 너를 좋아한것 뿐이니까
